,article_feed,title,content,published_date,source_url,categories
97,http://qz.com/feed,Tesla has been a tech stock stinker as Microsoft joins Apple in the $3 trillion club,"<img class=""type:primaryImage"" src=""https://i.kinja-img.com/image/upload/c_fit,q_80,w_636/aac2eab778880d7284d7f4648437ad03.jpg"" /><p>At the top of the year, the Wall Street Journal <a class=""sc-1out364-0 dPMosf sc-145m8ut-0 lcFFec js_link"" href=""https://www.wsj.com/finance/optimism-abounds-wall-street-this-new-year-a0ec5cc0"" rel=""noopener noreferrer"" target=""_blank"">let the world know</a> about the “Magnificent Seven,” a basket of tech stocks that traders were hyping up for the high profits amid a period of economic uncertainty. </p><p><a href=""https://qz.com/tesla-stock-down-magnificent-seven-microsoft-apple-1851194022"">Read more...</a></p>",2024-01-24 21:23:00,https://qz.com/tesla-stock-down-magnificent-seven-microsoft-apple-1851194022,riot
98,http://qz.com/feed,Shah Rukh Khan: The king of cinema is back,"<img class=""type:primaryImage"" src=""https://i.kinja-img.com/image/upload/c_fit,q_80,w_636/ab36dd4905fad76f26e1cc4cdbaa47b9.jpg"" /><p><strong>Back with a bang</strong><br /></p><p><a href=""https://qz.com/emails/quartz-obsession/1851193320/shah-rukh-khan-the-king-of-cinema-is-back"">Read more...</a></p>",2024-01-24 21:08:00,https://qz.com/emails/quartz-obsession/1851193320/shah-rukh-khan-the-king-of-cinema-is-back,others
99,http://qz.com/feed,Netflix password-sharing crackdown and price hikes will drive revenue 'for years',"<img class=""type:primaryImage"" src=""https://i.kinja-img.com/image/upload/c_fit,q_80,w_636/a32d9d4a925ebadbd05c002fe9668555.jpg"" /><p>Netflix’s <a class=""sc-1out364-0 dPMosf sc-145m8ut-0 lcFFec js_link"" href=""https://qz.com/netflix-password-sharing-crackdown-us-household-1850468506"" rel=""noopener noreferrer"" target=""_blank"">password-sharing crackdown</a>—which the company more affectionately calls “paid sharing,” “the right nudge at the right time”—not only paid off immediately after the company implemented it last May, but even more so in the months that followed.<br /></p><p><a href=""https://qz.com/netflix-password-sharing-crackdown-and-price-hikes-are-1851193478"">Read more...</a></p>",2024-01-24 20:10:00,https://qz.com/netflix-password-sharing-crackdown-and-price-hikes-are-1851193478,political_unrest
100,http://qz.com/feed,It turns out oil gets more expensive to ship when boats go boom in the Red Sea,"<img class=""type:primaryImage"" src=""https://i.kinja-img.com/image/upload/c_fit,q_80,w_636/dd7143e78390e16321add067c3440b5f.jpg"" /><p>The oil comes out the ground, the oil gets sold, the oil gets shipped somewhere, the oil gets turned into gasoline and plastic and all the stuff we use to go about our lives. All of these steps in the process affect the price of the oil itself, and three of them get the most attention, but only one of them is getting…</p><p><a href=""https://qz.com/fighting-red-sea-oil-prices-increasing-1851192473"">Read more...</a></p>",2024-01-24 19:31:07,https://qz.com/fighting-red-sea-oil-prices-increasing-1851192473,others
101,http://qz.com/feed,Musicians are bargaining with Hollywood over AI,"<img class=""type:primaryImage"" src=""https://i.kinja-img.com/image/upload/c_fit,q_80,w_636/fbdd9fa1aacb02aff64c9b5bcd3d587c.jpg"" /><p>First, it was writers and actors. Then, it was <a class=""sc-1out364-0 dPMosf sc-145m8ut-0 lcFFec js_link"" href=""https://qz.com/the-marvel-universe-has-new-avengers-visual-effects-wo-1850718359"" rel=""noopener noreferrer"" target=""_blank"">visual effects workers</a>. Now, it’s musicians who are demanding Hollywood studios provide pay and consent for using artificial intelligence.</p><p><a href=""https://qz.com/afm-amptp-musicians-union-artificial-intelligence-1851192257"">Read more...</a></p>",2024-01-24 19:31:00,https://qz.com/afm-amptp-musicians-union-artificial-intelligence-1851192257,others
102,http://qz.com/feed,Writing your resume for a robot,"<img class=""type:primaryImage"" src=""https://i.kinja-img.com/image/upload/c_fit,q_80,w_636/e8293aeefafb69150ef3284b5e3197ba.jpg"" /><p>Hello, Quartz at Work readers!</p><p><a href=""https://qz.com/emails/quartz-at-work/1851192214/writing-your-resume-for-a-robot"">Read more...</a></p>",2024-01-24 15:01:00,https://qz.com/emails/quartz-at-work/1851192214/writing-your-resume-for-a-robot,others
103,http://qz.com/feed,"The best jobs of 2024, according to Indeed","<img class=""type:primaryImage"" src=""https://i.kinja-img.com/image/upload/c_fit,q_80,w_636/ae46eb49811ec34b3fc57d408f0dd2ac.jpg"" /><p>The top jobs in the US in 2024 are in mental healthcare, according to Indeed — and mental health technicians, mental health therapists, and psychiatrists are the best ones to apply for this year.</p><p><a href=""https://qz.com/best-jobs-2024-indeed-mental-healthcare-1851190781"">Read more...</a></p>",2024-01-24 15:00:00,https://qz.com/best-jobs-2024-indeed-mental-healthcare-1851190781,others
104,http://qz.com/feed,Why the US economy might be headed for a bumpy landing | Smart Investing,"<img class=""type:primaryImage"" src=""https://i.kinja-img.com/image/upload/c_fit,q_80,w_636/86871ee7a25653bcf3a70082b5ebd1ab.jpg"" /><p><a href=""https://qz.com/why-the-us-economy-might-be-headed-for-a-bumpy-landing-1851189884"">Read more...</a></p>",2024-01-24 12:00:00,https://qz.com/why-the-us-economy-might-be-headed-for-a-bumpy-landing-1851189884,others
105,http://qz.com/feed,AI is coming for your job application long before it comes for your job,"<img class=""type:primaryImage"" src=""https://i.kinja-img.com/image/upload/c_fit,q_80,w_636/9ec9150402a1ef48deaa0384334f39de.jpg"" /><p>In late 2017, Hilke Schellmann was closing out a conference in Washington, DC, when she hailed a ride to the train station. The filmmaker and New York University journalism professor hopped in her Lyft,  asked  the driver how he was doing, and was met with a pause. It had been a strange day, he answered. He’d applied…</p><p><a href=""https://qz.com/hr-software-ai-algorithms-bias-1851190372"">Read more...</a></p>",2024-01-24 10:00:00,https://qz.com/hr-software-ai-algorithms-bias-1851190372,others
106,http://qz.com/feed,United Airlines says growth will slow for years because of Boeing's 737 troubles,"<img class=""type:primaryImage"" src=""https://i.kinja-img.com/image/upload/c_fit,q_80,w_636/b058e7f7173bd8be72f23c8a20d8bdaf.jpg"" /><p>United Airlines expects its capacity growth to slow in the coming years, thanks to the  drama at its biggest aircraft supplier, Boeing.<br /></p><p><a href=""https://qz.com/united-airlines-says-its-growth-will-slow-for-years-bec-1851189943"">Read more...</a></p>",2024-01-23 23:26:50,https://qz.com/united-airlines-says-its-growth-will-slow-for-years-bec-1851189943,others
107,http://qz.com/feed,Lots of people started selling bitcoin after the SEC made it easier to buy,"<img class=""type:primaryImage"" src=""https://i.kinja-img.com/image/upload/c_fit,q_80,w_636/fb09f7ab32c9ab32711162accdc6c3f8.jpg"" /><p>There was a whole lot of excitement around the prospect of exchange-traded bitcoin funds a couple weeks ago, when the US Securities and Exchange Commission announced that it had <a class=""sc-1out364-0 dPMosf sc-145m8ut-0 lcFFec js_link"" href=""https://qz.com/first-bitcoin-exchange-traded-funds-are-cleared-by-us-r-1851157071"" rel=""noopener noreferrer"" target=""_blank"">approved use of the investing tool</a>. Someone even <a class=""sc-1out364-0 dPMosf sc-145m8ut-0 lcFFec js_link"" href=""https://www.reuters.com/technology/sec-account-hack-renews-spotlight-xs-security-concerns-2024-01-10/"" rel=""noopener noreferrer"" target=""_blank"">hacked the SEC’s account on the X social media platform</a> to break the news early! But that…</p><p><a href=""https://qz.com/lots-of-people-started-selling-bitcoin-after-the-sec-ma-1851190395"">Read more...</a></p>",2024-01-23 23:25:48,https://qz.com/lots-of-people-started-selling-bitcoin-after-the-sec-ma-1851190395,riot
108,http://qz.com/feed,"Brex, once a Silicon Valley darling, is laying off 20% of its workforce","<img class=""type:primaryImage"" src=""https://i.kinja-img.com/image/upload/c_fit,q_80,w_636/6529f0dc9506f74ecf6a34d91db969fb.jpg"" /><p><a class=""sc-1out364-0 dPMosf sc-145m8ut-0 lcFFec js_link"" href=""https://qz.com/1721642/brex-cash-claims-sipc-protection-checking-poses-a-challenge"" rel=""noopener noreferrer"" target=""_blank"">Brex</a>, a US <a class=""sc-1out364-0 dPMosf sc-145m8ut-0 lcFFec js_link"" href=""https://qz.com/emails/future-of-finance/1744003/quartz-future-of-finance-what-fintech-means-to-visa-and-mastercard"" rel=""noopener noreferrer"" target=""_blank"">fintech</a> startup, has cut more than 200 employees from its 1,000-person workforce. This move shows that even a decacorn—a privately held company with a valuation topping $10 billion—isn’t immune to job losses. The startup said it’s doing some restructuring, according to an email sent today (Jan. 23) to an…</p><p><a href=""https://qz.com/brex-once-a-silicon-valley-darling-is-laying-off-20-1851189051"">Read more...</a></p>",2024-01-23 18:42:00,https://qz.com/brex-once-a-silicon-valley-darling-is-laying-off-20-1851189051,others
109,http://qz.com/feed,Netflix is paying $5 billion to be the home of WWE's Monday Night Raw,"<img class=""type:primaryImage"" src=""https://i.kinja-img.com/image/upload/c_fit,q_80,w_636/4655637a938ad6a6701a90d1718709f4.jpg"" /><p>Once upon a time, the main proposition of streaming services like Netflix was that you could watch what you wanted, when you wanted. But as the services have increasingly started bailing on creating original content that users could pick up from libraries, they’ve been investing more in live events such as sports.…</p><p><a href=""https://qz.com/netflix-is-paying-5-billion-to-be-the-home-of-wwes-mon-1851188480"">Read more...</a></p>",2024-01-23 18:39:00,https://qz.com/netflix-is-paying-5-billion-to-be-the-home-of-wwes-mon-1851188480,positive
110,http://qz.com/feed,TikTok workers feel tech's troubles as the company cuts 60 jobs,"<img class=""type:primaryImage"" src=""https://i.kinja-img.com/image/upload/c_fit,q_80,w_636/05c5e1c2009949c0bb6eb7dd2b7f9749.jpg"" /><p>Tech employees have taken to TikTok to tell the world about their layoffs. Now, TikTok workers themselves are the ones with the problem.<br /></p><p><a href=""https://qz.com/tiktok-workers-feel-techs-troubles-as-the-company-cuts-1851188391"">Read more...</a></p>",2024-01-23 15:01:00,https://qz.com/tiktok-workers-feel-techs-troubles-as-the-company-cuts-1851188391,others
111,http://qz.com/feed,China is importing fewer chips and more chipmaking machines,"<img class=""type:primaryImage"" src=""https://i.kinja-img.com/image/upload/c_fit,q_80,w_636/2b52512e1fef42681ebb97f7d5231165.jpg"" /><p>In a clear sign of Beijing’s efforts to speed up the development of its homegrown semiconductor industry amid Washington’s intensifying technology restrictions, China’s imports of chipmaking machines <a class=""sc-1out364-0 dPMosf sc-145m8ut-0 lcFFec js_link"" href=""https://www.bloomberg.com/news/articles/2024-01-22/china-buys-near-record-40-billion-of-chip-gear-to-beat-us-curbs"" rel=""noopener noreferrer"" target=""_blank"">hit a near-record</a> last year—while its chip imports saw their <a class=""sc-1out364-0 dPMosf sc-145m8ut-0 lcFFec js_link"" href=""https://www.bloomberg.com/news/articles/2024-01-15/us-china-chip-war-china-sees-biggest-drop-in-imports-on-record-in-2023"" rel=""noopener noreferrer"" target=""_blank"">steepest decline on record</a>. </p><p><a href=""https://qz.com/china-import-fewer-semiconductors-more-chipmaking-machi-1851188247"">Read more...</a></p>",2024-01-23 14:29:00,https://qz.com/china-import-fewer-semiconductors-more-chipmaking-machi-1851188247,terrorism
112,http://qz.com/feed,One way China is growing more dependent on Taiwan,"<img class=""type:primaryImage"" src=""https://i.kinja-img.com/image/upload/c_fit,q_80,w_636/df5113f60a04b02d6009312b242d5ec0.jpg"" /><p>Intermediate goods are inputs used to produce a final product. Think textiles to make a coat, metals to make a car, and computer chips to make an iPhone. </p><p><a href=""https://qz.com/china-taiwan-intermediate-goods-1851187726"">Read more...</a></p>",2024-01-23 12:00:00,https://qz.com/china-taiwan-intermediate-goods-1851187726,others
113,http://qz.com/feed,1.8 billion reasons why Wall Street loves the fashion world's favorite hiking sneakers,"<img class=""type:primaryImage"" src=""https://i.kinja-img.com/image/upload/c_fit,q_80,w_636/600b3f8558298e0749800591909eda28.jpg"" /><p>Back in 2016, hiking shoe specialist Salomon was set to destroy the molds for its XT-6 sneaker. The model had debuted four years earlier and was getting cycled out. But Jean-Philippe Lalonde, a special projects manager tasked with breaking the company into the fashion world, told the production department to pump the…</p><p><a href=""https://qz.com/1-8-billion-reasons-why-wall-street-loves-the-fashion-w-1851186408"">Read more...</a></p>",2024-01-22 22:21:00,https://qz.com/1-8-billion-reasons-why-wall-street-loves-the-fashion-w-1851186408,riot
114,http://qz.com/feed,"Millions live near US railways shipping the toxic chemical that contaminated East Palestine, Ohio","<img class=""type:primaryImage"" src=""https://i.kinja-img.com/image/upload/c_fit,q_80,w_636/c1603ce6c5d0819314bd810ac7ffe889.jpg"" /><p>The toxic, flammable gas that notoriously spilled into the town of East Palestine, Ohio, last year still rides on rail lines through eight major US cities. In fact, as much as <a class=""sc-1out364-0 dPMosf sc-145m8ut-0 lcFFec js_link"" href=""https://toxicfreefuture.org/press-room/new-research-reveals-up-to-36-million-pounds-of-toxic-chemical-vinyl-chloride-are-transported-across-north-american-railways-at-any-moment-putting-millions-at-risk/"" rel=""noopener noreferrer"" target=""_blank"">36 million pounds</a> of the chemical, vinyl chloride,<strong></strong>are carried on trains through the country at any given time, according to a new study by…</p><p><a href=""https://qz.com/millions-live-near-us-railways-shipping-the-toxic-chemi-1851186374"">Read more...</a></p>",2024-01-22 22:04:00,https://qz.com/millions-live-near-us-railways-shipping-the-toxic-chemi-1851186374,terrorism
115,http://qz.com/feed,"It's expensive to replace humans with AI, MIT says","<img class=""type:primaryImage"" src=""https://i.kinja-img.com/image/upload/c_fit,q_80,w_636/c2039d50f7f7c17c675f0e466ead800c.jpg"" /><p>Fears of robots taking over people’s jobs have been a recurring theme <a class=""sc-1out364-0 dPMosf sc-145m8ut-0 lcFFec js_link"" href=""https://qz.com/1681832/the-history-of-the-future-of-work#:~:text=Today%20many%20worry%20that%20strides,supposedly%20denied%20a%20patent%20to"" rel=""noopener noreferrer"" target=""_blank"">for centuries</a>, and with recent advancements in AI, the <a class=""sc-1out364-0 dPMosf sc-145m8ut-0 lcFFec js_link"" href=""https://www.bbc.com/worklife/article/20230418-ai-anxiety-artificial-intelligence-replace-jobs"" rel=""noopener noreferrer"" target=""_blank"">anxiety has resurfaced</a>. But fear not, humans! A <a class=""sc-1out364-0 dPMosf sc-145m8ut-0 lcFFec js_link"" href=""https://www.bloomberg.com/news/articles/2024-01-22/humans-still-cheaper-than-ai-in-vast-majority-of-jobs-mit-finds?sref=P6Q0mxvj"" rel=""noopener noreferrer"" target=""_blank"">new study </a>from the Massachusetts Institute of Technology (MIT) offers a reassuring perspective: most jobs are currently too expensive to automate…</p><p><a href=""https://qz.com/mit-research-jobs-ai-computer-vision-high-cost-1851184898"">Read more...</a></p>",2024-01-22 21:46:00,https://qz.com/mit-research-jobs-ai-computer-vision-high-cost-1851184898,positive
116,http://feeds.foxnews.com/foxnews/politics,White House demands Speaker Johnson give Biden 'authority and funding' to 'secure the border',The White House is refuting Speaker Mike Johnson&apos;s argument that the power to fix the border crisis lies with President Biden.,,https://www.foxnews.com/politics/white-house-demands-speaker-johnson-give-biden-authority-funding-secure-border,natural_disaster
117,http://feeds.foxnews.com/foxnews/politics,US lawmakers see wave of new bills aiming to define antisemitism,"Lawmakers across the U.S. are proposing laws to define antisemitism, sparking debates about free speech and international politics in state legislation.",,https://www.foxnews.com/politics/us-lawmakers-see-wave-new-bills-aiming-define-antisemitism,natural_disaster
118,http://feeds.foxnews.com/foxnews/politics,White House: Developers of ‘powerful AI systems’ now have to report safety test results to government,"The White House says under a President Biden executive order, companies developing “powerful AI systems&quot; now must report safety test results to the government",,https://www.foxnews.com/politics/white-house-developers-powerful-ai-systems-report-safety-test-results-government,political_unrest
119,http://feeds.foxnews.com/foxnews/politics,Red states pushing to block abortion measures from statewide ballots ahead of 2024 election,"Legislators in Mississippi and Missouri are blocking abortion ballot measures, arguing out-of-state cash cows are running the measures through.",,https://www.foxnews.com/politics/red-states-pushing-block-abortion-measures-statewide-ballots-2024-election,terrorism
120,http://feeds.foxnews.com/foxnews/politics,New Jersey Democrats seeking to cover out-of-pocket abortion costs,New Jersey Gov. Phil Murphy and the state&apos;s Democrat-led Legislature are proposing a measure to cover out-of-pocket costs for a woman wanting an abortion.,,https://www.foxnews.com/politics/new-jersey-democrats-seeking-cover-out-pocket-abortion-costs,political_unrest
121,http://feeds.foxnews.com/foxnews/politics,"NSA purchases Americans' internet browsing data without warrants, senator's documents show","The National Security Agency buys Americans&apos; internet browsing information, including about the websites they visit and the apps they use, without warrants, Sen. Ron Wyden revealed.",,https://www.foxnews.com/politics/nsa-purchases-americans-internet-browsing-data-without-warrants-senator-documents,terrorism
122,http://feeds.foxnews.com/foxnews/politics,House lawmakers to shine light on how AI can make Congress ‘more efficient’,"Artificial Intelligence is being integrated into more and more parts of every day life, including the day-to-day operations of the federal government.",,https://www.foxnews.com/politics/house-lawmakers-shine-light-how-ai-make-congress-more-efficient,political_unrest
123,http://feeds.foxnews.com/foxnews/politics,Trump aide's sentence for defying Congress highlights 'two-tier' justice system: observer,"Former Trump adviser Peter Navarro has been sentenced to prison for flouting a congressional subpoena, and one legal expert is calling foul on the DOJ for its double standards.",,https://www.foxnews.com/politics/trump-aides-sentence-defying-congress-highlights-two-tier-justice-system-observer,terrorism
124,http://feeds.foxnews.com/foxnews/politics,Vulnerable House Dem caught on Zoom call lamenting 'Trump Kool-Aid' voters in her district,"Rep. Susan Wild, D-Pa., said she was &quot;dismayed&quot; to find out she would be representing a county that strongly supports Donald Trump after redistricting efforts in the state.",,https://www.foxnews.com/politics/vulnerable-house-dem-caught-zoom-call-lamenting-trump-kool-aid-voters-district,natural_disaster
125,http://feeds.foxnews.com/foxnews/politics,Republicans probe CCP-tied nonprofit funneling money to US eco groups,FIRST ON FOX: The GOP chairs of three House committees are launching a joint investigation into a eco group with ties to China that has funneled money to U.S. climate initiatives.,,https://www.foxnews.com/politics/republicans-probe-ccp-tied-nonprofit-funneling-money-us-eco-groups,terrorism
126,http://feeds.foxnews.com/foxnews/politics,"Former Green Beret shreds 'criminally incompetent' Biden, stresses need for more veterans in Congress","Former Green Beret Pat Harrigan, a Republican from North Carolina, ripped President Biden as &quot;criminally incompetent,&quot; and stressed the need for more veterans in Congress.",,https://www.foxnews.com/politics/former-green-beret-shreds-criminally-incompetent-biden-stresses-need-more-veterans-congress,others
127,http://feeds.foxnews.com/foxnews/politics,"Republican ex-judge argued Trump engaged in insurrection, should be removed from Illinois primary ballot",A Republican retired judge is arguing that former President Trump should be removed from Illinois’ primary ballot for engaging in an insurrection in the Jan. 6 US Capitol attacks.,,https://www.foxnews.com/politics/republican-ex-judge-argued-trump-engaged-insurrection-should-removed-illinois-primary-ballot,others
128,http://feeds.foxnews.com/foxnews/politics,'Brazen attack': Trump blasts Biden after 3 US service members killed by Iran-backed militia,Donald Trump lashed out at President Biden and his administration in response to three American troops being killed in a drone strike in Jordan on Sunday.,,https://www.foxnews.com/politics/brazen-attack-trump-biden-3-us-services-members-killed-iran-backed-militia,terrorism
129,http://feeds.foxnews.com/foxnews/politics,Iran-backed militia kills 3 US troops just weeks after Biden said Tehran knows 'not to do anything',President Biden expressed confidence weeks before Iran-backed militia groups killed U.S. troops in Jordan that Iran knew &quot;not to do anything.&quot;,,https://www.foxnews.com/politics/iran-backed-militia-kills-3-us-troops-just-weeks-biden-said-tehran-knows-not-do-anything,others
130,http://feeds.foxnews.com/foxnews/politics,"Haley blasts RNC for rushing to Trump as nominee, calls on Americans to 'remember what normal felt like'",Nikki Haley ripped the Republican National Committee for siding with former President Donald Trump to be the party&apos;s presidential nominee.,,https://www.foxnews.com/politics/haley-blasts-rnc-rushing-trump-nominee-calls-americans-remember-what-normal-felt-like,terrorism
131,http://feeds.foxnews.com/foxnews/politics,Illinois suburb scraps migrant housing 'sign-up' sheet after councilman’s viral proposal to residents,"Naperville, an affluent suburb outside Chicago, will not move forward with a sign-up sheet for those residents who wish to house migrants.",,https://www.foxnews.com/politics/illinois-suburb-scraps-migrant-housing-sign-up-sheet-councilmans-viral-proposal-residents,others
132,http://feeds.foxnews.com/foxnews/politics,Lankford cites 'election year' for waning GOP support on border bill: 'Not about letting 5000 people in a day',"Sen. James Lankford, R-Okla., on Sunday explained why he is moving forward on border bill negotiations despite Republican concern of handing President Biden an election year win.",,https://www.foxnews.com/politics/lankford-cites-election-year-waning-gop-support-border-bill-not-about-letting-5000-people-a-day,natural_disaster
133,http://feeds.foxnews.com/foxnews/politics,Trump admin cut funding to UN agency now accused of participating in Hamas attack ‘for reason’: Rep. McCaul,Texas Republican Rep. Michael McCaul highlighted on &quot;Fox News Sunday&quot; that former President Trump cut funding to the United Nations Relief and Works Agency during his administration.,,https://www.foxnews.com/politics/trump-admin-cut-funding-un-agency-now-accused-participating-hamas-attack-reason-rep-mccaul,terrorism
134,http://feeds.foxnews.com/foxnews/politics,"Newsom claims Biden has border plan, blames Republicans for standing in the way",Democrats and Republicans continue pointing fingers to blame who is responsible for the crisis at the U.S.-Mexico border involving illegal immigrants.,,https://www.foxnews.com/politics/newsom-claims-biden-border-plan-blames-republicans-standing-way,natural_disaster
135,http://feeds.foxnews.com/foxnews/politics,AOC says Biden 'can do more' to earn votes than just attack Trump,Rep. Alexandria Ocasio-Cortez called on President Biden to &quot;do more&quot; to earn votes for re-election by offering free education and health care.,,https://www.foxnews.com/politics/aoc-says-biden-can-do-more-earn-votes-just-attack-trump,terrorism
136,http://feeds.foxnews.com/foxnews/politics,"3 American troops killed, 25 injured in attack on Jordan base near Syria border",President Biden blamed &quot;radical Iran-backed militant groups&quot; after three U.S. service members were killed and 25 others were hurt in Jordan near the Syrian border.,,https://www.foxnews.com/politics/3-american-troops-killed-25-injured-attack-jordan-base-near-syria-border,terrorism
137,http://feeds.foxnews.com/foxnews/politics,"E. Jean Carroll's claims against Trump, lifestyle back under the spotlight after eye-popping verdict",Former President Donald Trump faced his second trial involving former Elle columnist E. Jean Carroll and her accusations he defamed her when she accused him of rape.,,https://www.foxnews.com/politics/e-jean-carrolls-claims-against-trump-lifestyle-back-under-spotlight-eye-popping-verdict,others
138,http://feeds.foxnews.com/foxnews/politics,House Republicans unveil articles of impeachment against DHS Sec. Mayorkas,"House Republicans released two articles of impeachment against DHS Sec. Alejandro Mayorkas, but the Biden administration argues they are &quot;baseless.&quot;",,https://www.foxnews.com/politics/house-republicans-unveil-articles-impeachment-dhs-sec-mayorkas,others
